{
  "$schema": "http://json-schema.org/draft-07/schema#",
  "$id": "https://mimarca.me/negocio/_schema/card.schema.json",
  "title": "Mi Tarjeta Pro · tarjeta JSON",
  "type": "object",
  "required": [
    "slug",
    "theme",
    "business",
    "primaryCta"
  ],
  "additionalProperties": true,
  "properties": {
    "slug": {
      "type": "string",
      "pattern": "^[a-z0-9-]+$"
    },
    "theme": {
      "type": "string",
      "minLength": 1
    },
    "language": {
      "type": "string",
      "enum": [
        "es-MX",
        "en-US",
        "fr-CA"
      ]
    },
    "business": {
      "type": "object",
      "required": [
        "name"
      ],
      "additionalProperties": true,
      "properties": {
        "name": {
          "type": "string",
          "minLength": 1
        },
        "subname": {
          "type": "string"
        },
        "verified": {
          "type": "boolean"
        },
        "tagline": {
          "type": "string"
        },
        "rating": {
          "type": "number"
        },
        "established": {
          "type": "integer"
        },
        "logoUrl": {
          "type": "string"
        },
        "heroBackgroundUrl": {
          "type": "string",
          "description": "URL de foto de fondo para el hero (cover image). Si se define, .biz-hero muestra la foto con overlay oscuro en vez del fondo de color del tema."
        },
        "city": {
          "type": "string"
        }
      }
    },
    "status": {
      "type": "object"
    },
    "orderStage": {
      "type": "string",
      "enum": [
        "paid",
        "designing",
        "review",
        "published"
      ],
      "description": "Estatus del pedido mostrado en mi-cuenta. 'published' es el estado final una vez que la tarjeta ya está en vivo."
    },
    "ownerEmail": {
      "type": "string",
      "description": "DEPRECATED en JSON público. Vivir en Cloudflare KV (secrets:<slug>).ownerEmail"
    },
    "package": {
      "type": "string",
      "enum": [
        "lanzamiento",
        "personalizado",
        "premium"
      ],
      "description": "DEPRECATED en JSON público — vive en Cloudflare KV (secrets:<slug>).package. Define el cupo de links autoeditables en mi-cuenta (ver LINKS_QUOTA_BY_PACKAGE en workers/stripe-webhook/src/portal.js): 3 / 6 / 12."
    },
    "primaryCta": {
      "type": "object",
      "required": [
        "url",
        "label"
      ],
      "additionalProperties": true,
      "properties": {
        "label": {
          "type": "string",
          "minLength": 1
        },
        "subtitle": {
          "type": "string"
        },
        "icon": {
          "type": "string"
        },
        "url": {
          "type": "string",
          "minLength": 1
        }
      }
    },
    "links": {
      "type": "array"
    },
    "servicesTitle": {
      "type": "string"
    },
    "services": {
      "type": "array"
    },
    "servicesDisclaimer": {
      "type": "string"
    },
    "servicesLayout": {
      "type": "string",
      "enum": [
        "list",
        "menu"
      ],
      "description": "'list' es el estilo por defecto. 'menu' da a cada servicio un layout tipo menú de restaurante (miniatura + línea punteada + precio)."
    },
    "gallery": {
      "type": "array"
    },
    "galleryLayout": {
      "type": "string",
      "enum": [
        "grid",
        "feed"
      ],
      "description": "'grid' es el mosaico 3 columnas por defecto. 'feed' muestra las imágenes a 100% de ancho, tipo portafolio."
    },
    "brandCardCopy": {
      "type": "string"
    },
    "copyright": {
      "type": "string"
    },
    "changeRequestUrl": {
      "type": "string"
    },
    "ownerToken": {
      "type": "string",
      "description": "DEPRECATED en JSON público. Vivir en Cloudflare KV (secrets:<slug>).ownerToken"
    },
    "referralCode": {
      "type": "string",
      "pattern": "^[A-Z0-9]{4,16}$",
      "description": "DEPRECATED en JSON público. Código de referido en KV (secrets:<slug>).referralCode + ref:<CODE>"
    }
  }
}
